{
  "build_number": "0057",
  "candidate": "RC1",
  "peptide": "Tesamorelin",
  "clinical_recommendation_authorised": false,
  "clinical_decision_support_authorised": false,
  "approvers": [],
  "record_type": "tesamorelin_simulation_acceptance_decision",
  "record_id": "",
  "ingested_source_count": 0,
  "verified_source_count": 0,
  "open_critical_gaps": [],
  "unresolved_safety_signals": [],
  "workflow_replay_state": "PARTIAL",
  "audit_trail_complete": false,
  "prohibited_scope": [
    "clinical recommendation",
    "dosing",
    "diagnosis",
    "prescribing"
  ],
  "decision": "HOLD"
}
